<?xml version="1.0" encoding="UTF-8"?>
<interesovanje_za_vakcinisanje
        xmlns="http://www.ftn.uns.ac.rs/interesovanje"
        xmlns:xsi="http://www.w3.org/2001/XMLSchema-instance"
        xsi:schemaLocation="http://www.ftn.uns.ac.rs/interesovanje
    interesovanje.xsd">
    <licni_podaci>
        <drzavljanstvo>Drzavljanin Republike Srbije</drzavljanstvo>
        <jmbg>1234567891234</jmbg>
        <ime>Jovana</ime>
        <prezime>Jevtic</prezime>
        <adresa_elektronske_poste>jovana@gmail.com</adresa_elektronske_poste>
        <broj_mobilnog_telefona>061474749390</broj_mobilnog_telefona>
        <broj_fiksnog_telefona>0214658939</broj_fiksnog_telefona>
    </licni_podaci>
    <podaci_o_vakcinisanju>
        <opstina_vakcinisanja>Novi Sad</opstina_vakcinisanja>
        <tip_vakcine>Pfizer-BioNTech</tip_vakcine>
        <dobrovoljni_davalac_krvi>Da</dobrovoljni_davalac_krvi>
    </podaci_o_vakcinisanju>
    <datum_podnosenja>2021-06-11</datum_podnosenja>
</interesovanje_za_vakcinisanje>